Device Descriptor:
bcdUSB:             0x0200
bDeviceClass:         0x00
bDeviceSubClass:      0x00
bDeviceProtocol:      0x00
bMaxPacketSize0:      0x40 (64)
idVendor:           0x0483 (SGS Thomson Microelectronics)
idProduct:          0x5710
bcdDevice:          0x0200
iManufacturer:        0x01
0x0409: "STMicroelectronics"
iProduct:             0x02
0x0409: "HID Joystick in FS Mode"
iSerialNumber:        0x03
0x0409: "6D7242835548"
bNumConfigurations:   0x01

ConnectionStatus: DeviceConnected
Current Config Value: 0x01
Device Bus Speed:     Full
Device Address:       0x12
Open Pipes:              1

Endpoint Descriptor:
bEndpointAddress:     0x81
Transfer Type:   Interrupt
wMaxPacketSize:     0x0004 (4)
bInterval:            0x0A

Configuration Descriptor:
wTotalLength:       0x0022
bNumInterfaces:       0x01
bConfigurationValue:  0x01
iConfiguration:       0x00
bmAttributes:         0xE0 (Bus Powered Self Powered Remote Wakeup)
MaxPower:             0x32 (100 Ma)

Interface Descriptor:
bInterfaceNumber:     0x00
bAlternateSetting:    0x00
bNumEndpoints:        0x01
bInterfaceClass:      0x03 (HID)
bInterfaceSubClass:   0x01
bInterfaceProtocol:   0x02
iInterface:           0x00

HID Descriptor:
bcdHID:             0x0111
bCountryCode:         0x00
bNumDescriptors:      0x01
bDescriptorType:      0x22
wDescriptorLength:  0x004A

Endpoint Descriptor:
bEndpointAddress:     0x81
Transfer Type:   Interrupt
wMaxPacketSize:     0x0004 (4)
bInterval:            0x0A
