Device Descriptor:
bcdUSB:             0x0110
bDeviceClass:         0x00
bDeviceSubClass:      0x00
bDeviceProtocol:      0x00
bMaxPacketSize0:      0x08 (8)
idVendor:           0x2381
idProduct:          0x0100
bcdDevice:          0x0211
iManufacturer:        0x00
iProduct:             0x02
0x0409: "ProdipeMIDIlilo "
iSerialNumber:        0x00
bNumConfigurations:   0x01

ConnectionStatus: DeviceConnected
Current Config Value: 0x01
Device Bus Speed:     Full
Device Address:       0x14
Open Pipes:              2

Endpoint Descriptor:
bEndpointAddress:     0x81
Transfer Type:        Bulk
wMaxPacketSize:     0x0008 (8)
wInterval:          0x0000
bSyncAddress:         0x00

Endpoint Descriptor:
bEndpointAddress:     0x00
Transfer Type:     Control
wMaxPacketSize:     0x0509 (1289)
wInterval:          0x0202
bSyncAddress:         0x08

Configuration Descriptor:
wTotalLength:       0x0065
bNumInterfaces:       0x02
bConfigurationValue:  0x01
iConfiguration:       0x00
bmAttributes:         0x80 (Bus Powered )
MaxPower:             0x32 (100 Ma)

Interface Descriptor:
bInterfaceNumber:     0x00
bAlternateSetting:    0x00
bNumEndpoints:        0x00
bInterfaceClass:      0x01 (Audio)
bInterfaceSubClass:   0x01 (Audio Control)
bInterfaceProtocol:   0x00
iInterface:           0x00

Audio Control Interface Header Descriptor:
bLength:              0x09
bDescriptorType:      0x24
bDescriptorSubtype:   0x01
bcdADC:             0x0100
wTotalLength:       0x0009
bInCollection:        0x01
baInterfaceNr[1]:     0x01

Interface Descriptor:
bInterfaceNumber:     0x01
bAlternateSetting:    0x00
bNumEndpoints:        0x02
bInterfaceClass:      0x01 (Audio)
bInterfaceSubClass:   0x03 (MIDI Streaming)
bInterfaceProtocol:   0x00
iInterface:           0x00

Unknown Descriptor:
bDescriptorType:      0x24
bLength:              0x07
07 24 01 00 01 41 00 

Unknown Descriptor:
bDescriptorType:      0x24
bLength:              0x06
06 24 02 01 01 00 

Unknown Descriptor:
bDescriptorType:      0x24
bLength:              0x06
06 24 02 02 02 00 

Unknown Descriptor:
bDescriptorType:      0x24
bLength:              0x09
09 24 03 01 03 01 02 01 00 

Unknown Descriptor:
bDescriptorType:      0x24
bLength:              0x09
09 24 03 02 04 01 01 01 00 

Endpoint Descriptor:
bEndpointAddress:     0x81
Transfer Type:        Bulk
wMaxPacketSize:     0x0008 (8)
wInterval:          0x0000
bSyncAddress:         0x00

Unknown Descriptor:
bDescriptorType:      0x25
bLength:              0x05
05 25 01 01 03 

Endpoint Descriptor:
bEndpointAddress:     0x02
Transfer Type:        Bulk
wMaxPacketSize:     0x0008 (8)
wInterval:          0x0000
bSyncAddress:         0x00

Unknown Descriptor:
bDescriptorType:      0x25
bLength:              0x05
05 25 01 01 01 
